Year,Month,Area,Article,Author,Score,Sex,Notes,Funding,Clinical vs Biomedical,NIH
1999,December,N/A,Pathophysiological and genetic characterization of the major diabetes locus in GK rats,Galli et al,2,Male,"A score of 2 was given because only male mice were included and justified (No sexspecific effect for the gene was observed, and the larger size of the males facilitated the procedure, resulting in less experimental variation.) (Male GK and F344 rats)","Swedish Medical Research Council, Swedish Diabetes Association, Swedish Strategic Funds, Swedish Medical Association, and the following foundations: Gunvor och Josef Aner, Magnus Bergvall, Emil and Wera Cornell, Wera Ekstrom, Petrus och Augusta Hedlund, Lars Hiertas Minne, Sven Jerring, Novo Nordisk, Samariten, Gamla Tjanarinnor, and Ulf Widengrens Minne.",Biomedical,No
1999,December,N/A,A transcriptional repressor regulates mouse GLUT4 gene expression during the differentiation of 3T3-L1 cells,Yokomori et al,0,,A score of 0 was given because sex was unspecified for cell culture (3T3-L1 cells).,N/A,Biomedical,No
1999,December,N/A,Parent-offspring trios: A resource to facilitate the identification of type 2 diabetes genes,Frayling et al,3,,"A score of 3 was given because both sexes of human subjects were included, but there was no sex-segregated data.",British Diabetic Association,Biomedical,No
2009,January,Complications,Rho Kinase Inhibition by Fasudil Ameliorates Diabetes-Induced Microvascular Damage,Arita et al,1,Male,Only male Wistar rats were used. No explaination for female exlcusion provided.,"Grant-in-Aid for Scientific Research (Ministry of Education, Science, Sports and Culture, Japan), NIH, Massachusetts Lions Eye Research Fund, Marion W. and Edward F. Knight Fund, Research to Prevent Blindness",Biomedical,Yes
2009,January,Complications,Role of Glyceraldehyde 3-Phosphate Dehydrogenase in the Development and Progression of Diabetic Retinopathy,Kanwar et al,1,Male,"Only male Lewis rats were used, no reason given for female exlcusion","NIH, Juvenile Diabetes Research Foundation, The Thomas Foundation, and Research to Prevent Blindness",Biomedical,Yes
2009,February,Complications,Enhanced Expression of Janus Kinase–Signal Transducer and Activator of Transcription Pathway Members in Human Diabetic Nephropathy,Berthier et al.,1,Male,"Score of 1 was awarded due to the use of only male mice with no explaination for female exclusion. While the mice used in the experiment were all male, human samples were of unspecified sex (the paper states that clinical characteristics are available in an appendix table, but no such table is present in the version accessible online).",NIH  ,Biomedical,Yes
2009,April,Complications,FOXO1 Plays an Important Role in Enhanced Microvascular Cell Apoptosis and Microvascular Cell Loss in Type 1 and Type 2 Diabetic Rats,Behl et al.,0,N/A,"Score of 0 awarded, as the sex of the rats used (Sprague Dawley) was not specified. ","NIH, Massachusetts Lions Eye Research Organization",Biomedical,Yes
2009,April,Complications,Protective Effect of Perindopril on Diabetic Retinopathy Is Associated With Decreased Vascular Endothelial Growth Factor–to–Pigment Epithelium–Derived Factor Ratio; Involvement of a Mitochondria–Reactive Oxygen Species Pathway,Zheng et al.,1,Male,"Score of 1 awarded, as only male Sprague-Dawley rats were used. No justification was given for female exclusion. The sex of the cell line used (BRECs) was unspecified. ","Research Fund for the Doctoral Program of Higher Education of China, National Nature Science Funding of China",Biomedical,No
2009,May,Complications,"Specific Local Cardiovascular Changes of Nɛ-(Carboxymethyl)lysine, Vascular Endothelial Growth Factor, and Smad2 in the Developing Embryos Coincide With Maternal Diabetes–Induced Congenital Heart Defects",Roest et al.,0,N/a,3-month-old rats Sprague-Dawley rats sex unspecified and embryo sex unknown.,"Netherlands Heart Foundation grants NHS2002B035 and NHS2006B074, the Ernfors Family Fund, the Swedish Diabetes Association, and the Swedish Research Council Grant 12X-7475.",biomedical,No
2009,May,Complications,Hyperglycemia Induces a Dynamic Cooperativity of Histone Methylase and Demethylase Enzymes Associated With Gene-Activating Epigenetic Marks That Coexist on the Lysine Tail,Brasacchio et al.,1,Male,"Male apolipoprotein knockout (apoE KO) mice used for in vivo portion. Confluent bovine aortic endothelial cells sex unknown, human microvascular endothelial cells (HMECs) sex unknown used for in vitro portion. ","Juvenile Diabetes Research Foundation International (JDRF), the Diabetes Australia Research Trust, the National Health and Medical Research Council (NHMRC) of Australia, and the National Heart Foundation of Australia. A.E.-O., M.E.C., and A.C.C. are recipients of a Career Development Award, a Senior Principal Research Fellowship, and a Doherty Post-Doctoral fellowship, respectively, from the NHMRC. C.T. and A.B. are recipients of fellowships from the JDRF and the Foundation for Polish Science.",Biomedical,No
2009,June,Complications,Development of Selective Axonopathy in Adult Sensory Neurons Isolated From Diabetic Rats,Zherebitskaya et al.,1,Male,#NAME?,E.Z. was supported by grants to P.F. from the Canadian Institutes of Health Research (ROP-72893 and MOP-84214) and the Juvenile Diabetes Research Foundation (1-2008-193). D.R.S. was supported by a grant to P.F. from the Manitoba Health Research Council. This work was also funded by the St Boniface General Hospital and Research Foundation and the Manitoba Medical Services Foundation.,Biomedical,No
2009,June,Complications,Adaptive β-Cell Proliferation Is Severely Restricted With Advanced Age,Rankin et al.,1,Male,"- male F1 hybrid B6129SF1/J mice 1 and 8 mos old, -male F1 hybrid B6129SF1/J mice 1 mos","Juvenile Diabetes Research Foundation International (to J.A.K.). Additional support was provided by the National Institutes of Health (grants K08-DK064101, R03-DK078546, and R01-DK081469), a March of Dimes Basil O'Connor Starter Scholar Research Award, a Lawson Wilkins Pediatric Endocrine Society Clinical Scholar Award, a Charles H. Hood Foundation Child Health Research Grant, funds from The Children's Hospital of Philadelphia, and a University of Pennsylvania Diabetes and Endocrinology Research Center pilot and feasibility grant (DK19525).",Biomedical,Yes
2009,June,Complications,Gene Deletion of the Kinin Receptor B1 Attenuates Cardiac Inflammation and Fibrosis During the Development of Experimental Diabetic Cardiomyopathy,Westermann et al.,0,N/a,-Twenty-five B1R knockout mice (B1R−/−) C57/BL6 variety and 25 of their littermates (B1R+/+) 2 mos.,Deutsche Forschungsgemeinschaft,Biomedical,No
2009,June,Complications,Diabetic Retinal Neurodegeneration Is Associated With Mitochondrial Oxidative Stress and Is Improved by an Angiotensin Receptor Blocker in a Model Combining Hypertension and Diabetes,Silva et al.,1,Male,male spontaneously hypertensive rats (SHRs) and normotensive Wistar-Kyoto (WKY) rats,State of São Paulo Research Foundation (FAPESP) grants 04/00455-9 and 05/58189-5. K.C.S. was a recipient of a scholarship from the National Council for Scientific and Technological Development (CNPq).,Biomedical,No
2009,June,Complications,State of São Paulo Research Foundation (FAPESP) grants 04/00455-9 and 05/58189-5. K.C.S. was a recipient of a scholarship from the National Council for Scientific and Technological Development (CNPq).,Wang et al.,1,Male,"- 8- to 10-week-old MT-TG positive mice (heterozygotes) and negative littermates (wild type), MALE",American Diabetes Association (02-07-JFA-10 and 05-07-CD-02 [to L.C.] and 07-07-JF-23 [to W.F. and L.C.]) and the National Natural Scientific Foundation of China (30672495 [to X.-K.L.]) and also by a start-up fund for the Chinese-American Research Institute for Diabetic Complications from Wenzhou Medical College (to X.-K.L. and L.C.).,Biomedical,No
2009,July,Complications,(Pro)renin Receptor–Mediated Signal Transduction and Tissue Renin-Angiotensin System Contribute to Diabetes-Induced Retinal Inflammation,Satofuka et al.,0,N/a,"Used Long-Evans rats, C57BL/6 mice, and angiotensin II type 1 receptor (AT1-R)-deficient mice with streptozotocin-induced diabetes and treated them with (pro)renin receptor blocker (PRRB). No sex specified for any of the above animal models. No sex segregated data provided.","Japanese Ministry of Education, Culture, Sports, Science and Technology",Biomedical,No
2009,July,Complications,Allelic Depletion of grem1 Attenuates Diabetic Kidney Disease,Roxburgh et al.,1,Male,Used the male offspring result of the cross wild-type C57BL/6J and grem1+/− mice. Figures were not sex segregated. No explanation was given as to why the female offspring were not studied.,"Health Research Board of Ireland Clinical Fellowship, the Science Foundation Ireland and the Health Research Board Ireland.",Biomedical,No
2009,July,Complications,The Transforming Growth Factor-β Pathway Is a Common Target of Drugs That Prevent Experimental Diabetic Retinopathy,Gerhardinger et al.,1,Male,Male Sprague-Dawley rats were utilized. No explanation given to as why female Sprague-Dawley rats were not used.,"National Institutes of Health, Juvenile Diabetes Research Foundation (JDRF) Center for Diabetic Retinopathy at the Schepens Eye Research Institute, the Massachusetts Lions Eye Research Fund, and the George and Frances Levin Endowment.",Biomedical,Yes
2009,August,Complications,In Vivo Activation of AMP-Activated Protein Kinase Attenuates Diabetes-Enhanced Degradation of GTP Cyclohydrolase I,Wang et al.,1,Male,Used human umbilical vein endothelial cells sex unspecified and aortas isolated from streptozotocin-injected diabetic male mice.,"National Institutes of Health grants, American Diabetes Association, the Juvenile Diabetes Research Foundation, the Oklahoma Center for Advancement of Science and Technology, and the Travis Endowed Chair in Endocrinology, University of Oklahoma Health Sciences Center.",Biomedical,Yes
2009,Sept,Complications,Urinary Adiponectin Excretion,von Eynatten et al,3,,A score of 3 was given because both sexes of human subjects were used but no sex-segregated data was included. Sex was not mentioned in human kidney biopsies for adiponectin immunohistochemistry. (Sex was included as a variable in calculating Spearman correlation coefficients and in multivariable linear regression.),"Dr. Werner Jackstädt-Stiftung (to M.vE.), the Manfred Lautenschläger Stiftung (to P.P.N., A.B., and P.M.H.), and by IZKF Erlangen",Biomedical,No
2009,Sept,Complications,Effect of the Monocyte Chemoattractant Protein-1/CC Chemokine Receptor 2 System on Nephrin Expression in Streptozotocin-Treated Mice and Human Cultured Podocytes,Tarabra et al,0,,"A score of 0 was given because of unspecified sex of mice, cultured human podocytes, and human kidney sections used. Sex-matched control subjects were used for human renal biopsies.","European Federation for the Study of Diabetes (EFSD)/Lilly European Diabetes Research Programme, the University of Turin (ex-60% grant), the Piedmont Region Research Grant, and the Marie Curie Intra-European Fellowship within the 6th European Community Framework Programme",Biomedical,No
2009,October,Complications,Foxo1 Links Hyperglycemia to LDL Oxidation and Endothelial Nitric Oxide Synthase Dysfunction in Vascular Endothelial Cells,Tanaka et al,0,,A score of 0 was given because the sex of the cell culture and mice subjects were unspecified (primary human aortic endothelial cells and L1 mice),National Institutes of Health,Biomedical,Yes
2009,October,Complications,Selective Inhibition of Protein Kinase C β2 Attenuates Inducible Nitric Oxide Synthase–Mediated Cardiovascular Abnormalities in Streptozotocin-Induced Diabetic Rats,Nagareddy et al,1,Male,A score of 1 was given because only male rats were used (male Wistar rats).,Heart and Stroke Foundation of BC & Yukon. P.R.N. is a recipient of Doctoral Research Award from the Heart and Stroke Foundation of Canada and Senior Graduate Studentship from the Michael Smith Foundation for Health Research.,Biomedical,No
2009,October,Complications,"Vasohibin-1, a Negative Feedback Regulator of Angiogenesis, Ameliorates Renal Alterations in a Mouse Model of Diabetic Nephropathy",Nasu et al,1,Male,"A score of 1 was given because only male mice were mentioned (male imprinting control region mice), though the sex of cell culture was unspecified (primary murine mesangial cells (MES13)) which would give a score of 0 by itself.","Grant-in-Aid for Scientific Research from the Ministry of Education, Science and Culture of Japan (2005–2009, to Y.M.), Grant-in-Aid from the Japan Diabetes Foundation (2005, to Y.M.), the Takeda Science Foundation (2006, to Y.M.), and the Japan Foundation of Cardiovascular Research",Biomedical,No
2009,October,Complications,Dyslipidemia-Induced Neuropathy in Mice,Vincent et al,1,Female,"A score of 1 was given because only female mice were used for one part of the experiment (dorsal root ganglia from female Sprague-Dawley rats) and C57/BL6 mice of unspecified sex were used, which would give a score of 0 by itself.","National Institutes of Health Grant R24DK082841 (to S.P. and E.L.F.), the Juvenile Diabetes Research Foundation (to A.M.V. and E.L.F.), the American Diabetes Association (to A.M.V.), the Animal Models of Diabetes Complications Consortium (National Institutes of Health UO1 DK076160; to E.L.F.), and the Program for Neurology Research and Discovery",Biomedical,Yes
2009,October,Complications,Rac1 Is Required for Cardiomyocyte Apoptosis During Hyperglycemia,Shen et al,1,Male,A score of 1 was given because only male rats were used (male Sprague-Dawley rats).,Heart & Stroke Foundation of Ontario (NA 5940) and the Canadian Institutes of Health Research (MOP 93657) awarded to T.P. T.P. is a recipient of a New Investigator Award from Heart & Stroke Foundation of Canada and Rick Gallop Award for research excellence from Heart & Stroke Foundation of Ontario,Biomedical,No
2009,October,Complications,TIMP3 Is Reduced in Atherosclerotic Plaques From Subjects With Type 2 Diabetes and Increased by SirT1,Cardellini et al,3,,"A score of 3 was given because both sexes of human subjects were included but no sex-segregated data was presented. Although TIMP3 expression was analyzed to not have negative correlation with sex, the methods of analysis were not given.","SID Grant 2007, Ministry of Health RF2007, Telethon GGP08065, Juvenile Diabetes Research Foundation Grant 1-2007-665, a grant from Fondazione Roma 2008 (to M.F.), PRIN 2007 and ASI grant 2006 (to R.L.), and Start-up funds from the University of Texas Health Science Center (to F.F.).",Biomedical,No
2009,November,Complications,Selective T-Type Calcium Channel Blockade Alleviates Hyperalgesia in ob/ob Mice,Latham et al,2,Female,"A score of 2 was given because only female mice (female ob/ob mice) were included and was justified (lack of female pain studies despite higher prevalance of pain in females, easier to handle).","J.H.S. received grant support from Roche Pharmaceuticals. C.A. received grants from GlaxoSmithKline, sanofi-aventis, Amylin, Novo Nordisk, Roche Diagnostics, Kos Pharmaceuticals, the National Institutes of Health National Eye Institute and the American Diabetes Association, and speaker fees from sanofi-aventis and Takeda.",Biomedical,Yes
2009,November,Complications,"Vascular Endothelial Growth Factor Inhibition by dRK6 Causes Endothelial Apoptosis, Fibrosis, and Inflammation in the Heart via the Akt/eNOS Axis in db/db Mice",Park et al,1,Male,A score of 1 was given because only male mice were used (Male db/db and db/m mice).,"Catholic Medical Center Research Foundation (to C.W.P.) and the Basic Science Research Program through the National Research Foundation (NRF) of Korea funded by the Ministry of Education, Science and Technology (R01-2009-0073171).",Biomedical,No
2009,November,Complications,Caveolin-1 and Altered Neuregulin Signaling Contribute to the Pathophysiological Progression of Diabetic Peripheral Neuropathy,McGuire et al,0,,A score of 0 was given because the sex of wild-type C57Bl/6 and Cav1 knockout mice were unspecified.,Juvenile Diabetes Research Foundation and the National Institutes of Health (NS-054847 and DK-073594).,Biomedical,Yes
2009,December,Complications,Advanced Glycation End Products in Extracellular Matrix Proteins Contribute to the Failure of Sensory Nerve Regeneration in Diabetes,Duran-Jimenez,3,Both respectively,"A score of 3 was given because only male rats were used for some experiments (male Wistar rats) and only female rats used for other experiments (female Wistar rats), and no sex-segregated data was presented.",Diabetes U.K. N.J.G. was supported by Research Councils UK (RCUK) and British Pharmacological Society (BPS).,Biomedical,No
2009,January,Genetics,Genome-Wide Linkage Scan in Gullah-Speaking African American Families With Type 2 Diabetes,Sale et al,3,,"Used ~450 participants, 76.8% of which were female. No data was analyzed by sex","NIH, American Diabetes Association, W.M. Keck Foundation, General Clinical Research Center at the Medical University of South Carolina grant, Genetics Core Facility of the UAB Clinical Nutrition Research Unit grant, and by the South Carolina Center of Biomedical Research Excellence (COBRE) for Oral Health Grant",Biomedical,Yes
2009,January,Genetics,Genome-Wide Linkage and Admixture Mapping of Type 2 Diabetes in African American Families From the American Diabetes Association GENNID (Genetics of NIDDM) Study Cohort,Elbein et al,3,,"Majority of participants were female, but no data presented/ analyzed by sex",NIH,Biomedical,Yes
2009,January,Genetics,"Interleukin-6 Receptor Gene, Plasma C-Reactive Protein, and Diabetes Risk in Women",Qi et al,1,Female,Analysis of Nurse's blood collected between 1989 and 1990; all female likely due to the field being dominated by women. However this is not explicitly discussed; this is a secondary analysis of an old dataset.,"NIH, American Heart Association, Boston Obesity Nutrition center ",Biomedical,Yes
2009,January,Genetics,Genome-Wide Linkage Scan for Genes Influencing Plasma Triglyceride Levels in the Veterans Administration Genetic Epidemiology Study,Coletta et al,3,,"Stated that they adjusted for the 'significant effects of sex'. Data not presented by sex, nor were the 'significant effects of sex' discussed at all","Veterans Administration Epidemiologic grant, NIH, American Heart Association",Biomedical,Yes
2009,January,Genetics,Transcription Factor 7-Like 2 (TCF7L2) Polymorphism and Context-Specific Risk of Type 2 Diabetes in African American and Caucasian Adults,Yan et al,3,,"Study was done with human children: 868 male, 801 female, and 4 with ambiguous gender. No analysis by sex",NIH,Biomedical,Yes
2009,January,Genetics,Follow-Up Analysis of Genome-Wide Association Data Identifies Novel Loci for Type 1 Diabetes,Grant et al,3,,Both men and women included. No analysis by sex or any data presented by sex.,"NIH, Juvenile Diabetes Research Foundation International, Genome Canada, Cotswold Foundation, ",Biomedical,Yes
2009,February,Genetics,"Association Analysis of Variation in/Near FTO, CDKAL1, SLC30A8, HHEX, EXT2, IGF2BP2, LOC387761, and CDKN2B With Type 2 Diabetes and Related Quantitative Traits in Pima Indians",Rong et al.,3,N/A,"Score of 3 awarded, as both male and female data was included but sex differences/ similarities were not presented. The paper does state that statistical analysis included logistic regression analysis adjusted for covariates including sex, but this prevents the inclusion of sex-based data analysis.","NIH, American Diabetes Association",Biomedical,Yes
2009,February,Genetics,A Single-Nucleotide Polymorphism in a Methylatable Foxa2 Binding Site of the G6PC2 Promoter Is Associated With Insulin Secretion In Vivo and Increased Promoter Activity In Vitro,Dos Santos et al.,0,N/A,Score of 0 awarded because the sex of the cells and volunteers used was not metioned. Human islets from which DNA was isolated did not have their sex specified for the in vitro experiemnts. The sex of individuals in the in vivo study cohort (obese children) was also unspecified.,"Agence Nationale de la Recherche (ANR), Association Française des Diabétiques",Biomedical,No
2009,February,Genetics,Replication Study of Candidate Genes Associated With Type 2 Diabetes Based On Genome-Wide Screening,Tabara et al.,3,N/A,"Score of 3 awarded; while the sex of study participants is not listed, the article states that statistical analyses were adjusted for sex (thus implying inclusion of both men and women). No sex-based analysis or results are presented.","Grant-in-Aids for Scientific Research from The Ministry of Education, Culture, Sports, Science and Technology of Japan; The Ministry of Health, Labor and Welfare of Japan; the Japan Arteriosclerosis Prevention Fund; and a Research Promotion Award from Ehime University",Biomedical,No
2009,February,Genetics,Adiposity-Related Heterogeneity in Patterns of Type 2 Diabetes Susceptibility Observed in Genome-Wide Association Data,Timpson et al.,0,N/A,Score of 0 awarded as the sex the subjects involved was not specified.,"Diabetes UK, British Diabetic Association Research, the U.K. Medical Research Council, the Wellcome Trust, European Commission, MRC, Peninsula Medical School, Oxford National Institute for Health Research Biomedical Research Centre, ",Biomedical,No
2009,April,Genetics,Functional Characterization of Promoter Variants of the Adiponectin Gene Complemented by Epidemiological Data,Laumen et al.,0,N/A,"Score of 0 awarded, as the sex of the cell line used was not specified. For the functional studies, the sex of the cells used (3T3-L1) are not specified. For the epidemiological studies, both male and female data was included; paper states that all analyses were adjusted for sex. The majority of the data presented was obtained through the cell line studies, hence the score of 0 rather than 3.","Else Kröner-Fresenius-Stiftung, Bad Homburg, Helmholtz Zentrum München, German Research Centre for Environmental Health, German Federal Ministry of Education and Research, and by the State of Bavaria, German Ministry of Education and Research, Munich Centre of Health Sciences of the Ludwig-Maximilians-Universität Munich, Deutsche Forschungsgemeinschaft, Federal Ministry of Health and the Ministry of Innovation, Science, Research and Technology of the state North Rhine-Westphalia",Biomedical,No
2009,April,Genetics,Functional ENTPD1 Polymorphisms in African Americans With Diabetes and End-Stage Renal Disease,Friedman et al.,1,Male,"Score of 1 awarded, as th majority of figures (>50%) describe results of the mouse studies, which involved male animals. No justification for the exclusion of females was provided. Overall, the study involved multiple components (human participant study, human cell/lymphoblast study, mouse study). The human study used participants of unspecified sex, the cell study used cells of unspecified sex and the mouse study used male animals.",NIH,Biomedical,Yes
2009,April,Genetics,Type 1 Diabetes in the BB Rat: A Polygenic Disease,Wallis et al.,4,N/A,"Score of 4 awarded, as some results have been displayed by sex (diabetes free survival in BBDP) and some results are described seperately for the sexes (i.e. females displayed more severe islet atrophy). However, not all of the results have been reported in this way, and most of the data presented is not shown by sex.","Ontario Genomics Institute, CIHR, Ontario Research Foundation",Biomedical,No
2009,April,Genetics,"Genome-Wide Scan for Linkage to Type 1 Diabetes in 2,496 Multiplex Families From the Type 1 Diabetes Genetics Consortium",Concannon et al.,0,N/A,"Score of 0 awarded, as the sex of the individuals genotyped for this project was not listed. States that the location of IDDM15 is not known precisely, because male and female recombination maps differ greatly.","Juvenile Diabetes Research Foundation International, NIH, Wellcome Trust, National Institute for Health Research Cambridge Biomedical Research Centre",Biomedical,Yes
