Year,Month,Area,Article,Author,Score,Sex,Notes,Funding,Clinical vs Biomedical,NIH
1999,January,N/A,Metformin reduces systemic methylglyoxal levels in type 2 diabetes,Beisswenger et al,4,,"In the text of their study they state ""We also found no differences in MG levels between men and women (198.1 ± 54.5 vs. 180.1 ± 37.6 nmol/l, respectively; P = 0.16)"" However, they do not mention sex in reagrd to any of their other results (Metaformin level and DL level, Metaformin therapy and 3-DG levels, DL levels, etc.). Therefore, a socre of 4 awarded (since a minority of results were reported in reference to sex).","NIH, Bristol-Myers Squibb, by the Hitchcock Foundation",Clinical,Yes
1999,January,N/A,Polymorphism of the human beta3-adrenoceptor gene forms a well-conserved haplotype that is associated with moderate obesity and altered receptor function,Hoffstedt et al,4,,"""The distribution of 3-adrenoceptor haplotypes and the genotype-phenotype associations did not differ significantly according to sex"". However other results were not reported in reference to sex.","The Swedish Medical Research Council, Institute National de la Santé et de la Recherché Medicale (INSERM) France, the Swedish Diabetes Association, the Swedish Medical Society, the Swedish Heart and Lung Foundation, the Karolinska Institute, and the foundations of Söderberg, Novo Nordisk, Bergwall, Old Female Servants, King Gustav V, and Queen Victoria and Belvén",Clinical,No
1999,February,N/A,Renal glucose production during insulin-induced hypoglycemia in humans,Cersosimo et al.,3,N/A,"Score of 3 awared, as both male and female participants were involved in both treat groups. No sex-based based analysis was performed (data was pooled). ","NIH, American Diabetes Association",Clinical,Yes
1999,February,N/A,Contributions by kidney and liver to glucose production in the postabsorptive state and after 60 h of fasting.,Ekberg et al.,1,Male,"Score of 1 awarded, as only men were included in the study design. No justification for the exclusion of women was given.","Swedish Medical Research Council, Karolinska Institute, NIH",Clinical,Yes
1999,February,N/A,Cellular immune responses against proinsulin: no evidence for enhanced reactivity in individuals with IDDM.,Ellis et al.,3,N/A,"Score of 3 awarded, as both men and women were used as first degree relatives of IDDM patients. This paper does not give clinical characteristics for the IDDM patients or the control group volunteers; however, based on papers cited that used the same patient cohort (references 27 and 28) it would appear that individuals of both sexes were included. Data was not analyzed or presented by sex. ","NIH, American Diabetes Association, Juvenile Diabetes foundation",Clinical,Yes
1999,February,N/A,Phosphorylated insulin-like growth factor binding protein 1 is increased in pregnant diabetic subjects.,Gibson et al.,2,Female,"Score of 2 awarded, as this study was meant to examine the IGFBP-1 regulation during diabetic pregnancy, and therefore could only be performed using female participants. ","Central Manchester Healthcare National Health Service Trust, the Northwest Regional Health Authority, the Danish Diabetes Association, the Danish Medical Research Council, the Ruth Konig Petersen Foundation, the Novo Foundation, the Nordic Insulin Foundation, the Aage Louis-Hansen Memorial Foundation, and the Institute of Experfinental Clinical Research, University of Aarhus, Denmark",Clinical,No
1999,February,N/A,13C nuclear magnetic resonance study of glycogen resynthesis in muscle after glycogen-depleting exercise in healthy men receiving an infusion of lipid emulsion.,Delmas-Beauvieux et al.,1,Male,"Score of 1 awarded, as only male subjects were used. No justification for the exclusion of women was provided. ","CNRS, the Conseil Regional d'Aquitaine, the Delegation de la Recherche Clinique da Centre Hospitalier Universitaire de Bordeaux, the Victor Segalen Bordeaux 2 University, Nutrition Aquitaine, and the Fondation de France",Clinical,No
1999,February,N/A,High-fat meals reduce 24-h circulating leptin concentrations in women.,Havel et al.,1,Female,"Score of 1 awarded, as only women were used as subjects. No rationale for the exlcusion of men was given; experiment involved 19 individual women. Did state in the discussion that women have higher leptin levels than men, but did not state explicitly if this was why men were excluded from their study (the same section of the discussion also discusses a similar study involving both men and women, indicating that inclusion of men could have been possible).","Juvenile Diabetes Foundation, NIH",Clinical,Yes
1999,February,N/A,Plasma leptin and insulin levels in weight-reduced obese women with normal body mass index: relationships with body composition and insulin.,Guven et al.,1,Female,"Score of 1 awarded, as only premenopausal female subjects were used and no justification was provided for male exclusion. All subjects were recruited from the TOPS (take off pounds sensibly) club.",NIH,Clinical,Yes
1999,February,N/A,Rapid impairment of skeletal muscle glucose transport/phosphorylation by free fatty acids in humans.,Roden et al.,1,Male,"Score of 1 awarded, as only male particpants were included. No justification for female exclusion was provided. ","Austrian National Bank, Austrian Science Foundation, 1996 Joseph Skoda Award of the Austrian Society for Internal Medicine",Clinical,No
1999,February,N/A,Effect of intensive diabetes treatment on carotid artery wall thickness in the epidemiology of diabetes interventions and complications. Epidemiology of Diabetes Interventions and Complications (EDIC) Research Group., EDIC Research Group,6,N/A,"Score of 6 awarded, as study involved both male and female participants and all results were reported/analyzed seperatlely by sex. Experiments used sex-matched controls, and results were stratified by sex. Multivariate analyses (linear regression models) were  performed seperately for male and female data.  ",NIH,Clinical,Yes
1999,February,N/A,Effect of Acute Ketosis on the Endothelial Function of Type 1 Diabetic Patients; the Role of Nitric Oxide,Avogaro et al.,3,N/A,"Score of 3 awarded, as both men and women were included in the study. However, no data/ results have displayed or analyzed by sex. ",N/A,Clinical,N/A
1999,February,N/A,"Mutational analysis of the coding regions of the genes encoding protein kinase B-alpha and -beta, phosphoinositide-dependent protein kinase-1, phosphatase targeting to glycogen, protein phosphatase inhibitor-1, and glycogenin: lessons from a search for genetic variability of the insulin-stimulated glycogen synthesis pathway of skeletal muscle in NIDDM patients.",Hansen et al.,3,N/A,"Score of 3 awarded, as both men and women were involved as subjects. Experiments used sex-matched controls. No data/ results have been presented or analyzed by sex.","University of Copenhagen, The Danish Health Research Council, the Ve l u x Foundation, the Danish Diabetes Association, EEC",Clinical,No
1999,February,N/A,Diabetic Nephropathy Is Not Associated With the Dinucleotide Repeat Polymorphism Upstream of the Aldose Reductase (ALR2) Gene But With Erythrocyte Aldose Reductase Content in Japanese Subjects With Type 2 Diabetes,Maeda et al.,3,N/A,"Score of 3 awarded, as both male and female data was used; however, no data has been analyzed by sex. ",N/A,Clinical,N/A
1999,February,N/A,Mutation in the HNF-4 Gene Affects Insulin Secretion and Triglyceride Metabolism,Lehto et al.,3,N/A,"Score of 3 awarded, as data from both male and female subjects was included. No data was analyzed by sex. It should be noted that this study looked at a single family, including 6 mutation carriers (2 male, 4 female) and six non-diabetic relatives (2 male, 4 female). ","Sigrid Juselius Foundation, Swedish Medical Research Council, Medical Faculty of Lund University, Albert Påhlssons Foundation, Swedish Society for Medical Research, Finnish Diabetes Research Foundation and the Finnish Medical Society",Clinical,No
1999,March,N/A,Autoantibody appearance and risk for development of childhood diabetes in offspring of parents with type 1 diabetes: the 2-year analysis of the German BABYDIAB Study.,Ziegler et al.,3,N/A,"Score of 3 awarded as no sex specific data has been shown. This paper does make note that ""For antibody distributions at 9 months and 2 years, the point of inflexion for individual antibodies was remarkably similar between children from mothers with diabetes and those from fathers with diabetes and between boys and girls (data not shown). This suggests that the signals obtained in the antibody assays are not affected by age over the range 9 months to 2 years or by sex of offspring or proband."" This would indicate that some sort of sex based analysis did take place. However, because no details have been provided (no mention of the statistical test used to determine the lack of sex influence on islet autoantibodies, no reference to numerical results for either/both sexes, etc) this paper could not be scored above a 3. ","Bundesministerium für Forschung, Bildung und Technologie",Clinical,No
1999,March,N/A,Auto- and alloimmune reactivity to human islet allografts transplanted into type 1 diabetic patients.,Roep et al.,3,N/A,"Score of 3 awarded as both male and female patients were involved in the study (2 female 5 male). However, results were not discussed or analyzed by sex. Some results were notably attributed to specific patients (such as minor immunoreactivity occuring in patients VW, VC, and VM), and while it is possible to look and see the sex of the patients displaying different outcomes, potential trends based on sex were not addressed and no statistical tests were used to see if sex differences existed for any of the results.","Juvenile Diabetes Foundation International, the Royal Academy of Arts and Sciences in the Netherlands, the J.A. Cohen Institute (IRS), the Child Health and Wellbeing Fund, the European Union, the Vlaamse Gemeenschap, the Belgian Ministry of Science, and the Belgian Fonds Wetenschappelijk Onderzoek",Clinical,No
1999,March,N/A,Central nervous system effects of intranasally administered insulin during euglycemia in men,Kern et al.,1,Male,Score of 1 awarded as only male volunteers were involved in the study. No justification for female exclusion is provided.,N/A,Clinical,N/A
1999,March,N/A,Resistance to insulin's acute direct hepatic effect in suppressing steady-state glucose production in individuals with type 2 diabetes,Lewis et al.,3,N/A,"Score of 3 awarded as both men and women were involved in the study (6 men, 3 women). However, no results were analyzed or presented by sex.","Canadian Diabetes Association, Juvenile Diabetes Foundation, Medical Research Council of Canada",Clinical,No
1999,March,N/A,Effects of Fatty Acids and Ketone Bodies on Basal Insulin Secretion in Type 2 Diabetes,Boden et al.,3,N/A,"Score of 3 awarded as both male and female subjects were included in the study. However, no results were analyzed or reported by sex.",NIH,Clinical,Yes
1999,March,N/A,"Paraoxonase 192 Gln/Arg gene polymorphism, coronary artery disease, and myocardial infarction in type 2 diabetes",Pfohl et al.,3,N/A,"Score of 3 awarded as both male and female data was used. While the paper states that sex was considered an independent variable during data analysis, multivariate analysis was used to correct data for the influence of sex. This prevented researchers from being able to find or discuss potential sex differences, hence the score of 3.",N/A,Clinical,N/A
1999,March,N/A,The Quantitative Trait Locus on Chromosome 2 for Serum Leptin Levels Is Confirmed in A f r i c a n - A m e r i c a n s,Rotimi et al.,4,N/A,"Score of 4 awarded as both men and women were included and data were reported by sex in a table. However, sex differences/ similarities were not statistically analyzed (results are listed by sex, but there is no evidence that these results were compared by sex). The only results discussed in the context of sex in the text of the paper was that the serum leptin level from the Mexican-American men was about twice that of the African-American men (no reference to the women of either ethic group was made), and no statistical value/p-value is given to confirm statistical significance of this difference.",NIH,Clinical,Yes
1999,April,N/A,Insulin acutely regulates the expression of the peroxisome proliferator-activated receptor-gamma in human adipocytes,Rieusset et al.,4,N/A,"Score of 4 awarded as tissue samples were obtained from both men and women. Researchers found no difference in association between BMI and total PPAR-y in adipose tissue when they analyzed data seperately by sex (p-values were provided for each sex specific analysis). Other data was not reported or analyzed by sex (including total PPAR-y in skeletal tissue, insulin action/ insulin effect on PPAR-y mRNA expression in vitro, or insulin action in vivo). ","La Fondation de France, the INSERM program PROGRES, and ALFEDIAM-Novo Nordisk",Clinical,No
1999,April,N/A,Glucose entrainment of high-frequency plasma insulin oscillations in control and type 2 diabetic subjects,Mao et al.,3,N/A,"Score of 3 awarded as both male and female subjects were included. However, results were not analyzed by sex.","NIH, Endocrine Fellows Association",Clinical,Yes
1999,April,N/A,Inhibition of LDL oxidation in vitro but not ex vivo by troglitazone,Crawford et al.,0,N/A,Score of 0 awarded as sex is not specified for any experiment. In vitro studies used plasma obtained from individuals of unspecified sex. Ex vivo studies also failed to specify sex in the list of patient characteristics.,"Whittier Institute Grant, NIH",Clinical,Yes
1999,April,N/A,Gluconeogenesis in very low birth weight infants receiving total parenteral nutrition,Sunehag et al.,3,N/A,Score of 3 awarded as both male and female infants were included in the study. No results have been analyzed by sex.,"U.S. Department of Agriculture Cooperative Agreement and the General Clinical Research Center, National Center for Research Resources, NIH",Clinical,Yes
1999,April,N/A,Marked resistance of the ability of insulin to decrease arterial stiffness characterizes human obesity,Westerbacka et al.,1,Male,"Score of 1 awarded as only male subjects were used, and no justification was provided for female exclusion. ","Sigrid Juselius Foundation, the Academy of Finland",Clinical,No
1999,April,N/A,Effect of insulin on fat metabolism during and after normal pregnancy,Sivan et al.,2,Female,"Score of 2 awarded as only female subjects were included; this is justified, however, as the purpose of the study was to determine the effects of hyperinsulinema on free fatty acid turnover during and after pregnancy.",NIH,Clinical,Yes
1999,April,N/A,Effects of weight loss on regional fat distribution and insulin sensitivity in obesity,Goodpaster et al.,6,N/A,"Score of 6 awarded as both men and women were included in the study, and results have been reported and analyzed by sex. Sex differences are explicitly noted in the text of the article, along with associated p-values to back up statistically significant results.",NIH,Clinical,Yes
1999,April,N/A,Multiple metabolic defects during late pregnancy in women at high risk for type 2 diabetes,Xiang et al.,2,Female,"Score of 2 awarded as only female subjects were included. This was justified, however, as the purpose of the study was to investigate consequences of genstational diabetes on the mothers health.","NIH, Medical Research Service of the Department of Veterans Affairs",Clinical,Yes
1999,April,N/A,Is diabetic nephropathy inherited? Studies of glomerular structure in type 1 diabetic sibling pairs,Fioretto et al.,3,N/A,"Score of 3 awarded as as both male and female subjects were involved in the study. However, no sex-based analysis was performed. It is stated that controls were sex-matched with the diabetic cohort, and that sex distribution in experimental groups was 'similar'. ","National Center for Clinical Research Resources, NIH, Juvenile Diabetes Foundation International",Clinical,Yes
1999,April,N/A,Glucocorticoids and insulin promote plasminogen activator inhibitor 1 production by human adipose tissue,Morange et al.,1,Female,Score of 1 awarded as only female patients were included in the study. No justification for male exclusion has been provided.,"Institut National de la Santé et de la Recherche Médicale (INSERM), from the Foundation pour la Recherche Médicale, and from the Ministère de l’Education Nationale, de l’Enseignement Supérieur et de l’Insertion Professionnelle",Clinical,No
1999,April,N/A,Effect of glycemia on mortality in Pima Indians with type 2 diabetes,Sievers et al.,4,N/A,"Score of 4 awarded as both men and women were involved in the study. Some results are reported by sex in tables; however, sex was controlled for in much of the data analysis (by sex adjustment), preventing researchers from performing sex-based analyses for all results. Some sex differences were reported (such as that men were more likely than women to die of cardiovascular or other natural causes of death unrelated to diabetes), however the majority of data has been sex-adjusted.",N/A,Clinical,N/A
1999,April,N/A,Familial clustering of diabetic nephropathy in Brazilian type 2 diabetic patients,Canani et al.,3,N/A,"Score of 3 awarded as both male and female participants were included. However, no results were analyzed or reported by sex. Experimental groups were reported to be of similar sex composition.",Programa de Apoio a Núcleos de Excelência and the Hospital de Clínicas de Porto Alegre,Clinical,No
1999,April,N/A,Intermediate expansions of a GAA repeat in the frataxin gene are not associated with type 2 diabetes or altered glucose-induced beta-cell function in Danish Caucasians,Dalgaard et al.,3,N/A,Score of 3 awarded as both male and female data was included but analysis was not performed adequetely by sex. Multiple regression analyses were performed to control for the influence of sex. Paper explicitly states that sex was treated as a dependant variable (along with age and BMI) in their linear regression model.,"University of Copenhagen, the Velux Foundation, the Danish Diabetes Association, the Danish Medical Research Council, and the European Economic Community",Clinical,No
1999,April,N/A,Expression of naturally occurring variants in the muscle glycogen synthase gene,Orho-Melander et al.,3,N/A,"Score of 3 awarded as both male and female data was included. However, analysis of results was not done by sex. Two female patients have been singled out within the paper as being the sole carriers of two different variants/ mutations.","Sigrid Juselius Foundation, Albert Påhlssons Foundation, Swedish Medical Research Council,  Medical Faculty of Lund University, Malmö University Hospital, Ernhold Lundströms Foundation, Ernhold Lundströms Foundation, Novo Nordic Foundation, European Economical Community, Juvenile Diabetes Foundation International, Danish Health Research Council, Ministry of Education in Japan",Clinical,No
1999,April,N/A,Allelic Drop-Out in Exon 2 of the Hepatocyte Nuclear Factor- 1 Gene Hinders the I d e n t i fication of Mutations in Three Families With Maturity-Onset Diabetes of the Yo u n g,Ellard et al.,0,N/A,Score of 0 awarded as the sexes of the individuals/ families involved is not specified.,"British Diabetic Association, the Medical Research Council, the Royal Devon & Exeter NHS Healthcare Trust, the University of Exeter, and the Diabetes Research and Education Centre Trust",Clinical,No
1999,April,N/A,Altered beta-cell characteristics in impaired glucose tolerant carriers of a GAA trinucleotide repeat polymorphism in the frataxin gene,Hart et al.,3,N/A,Score of 3 awarded as both sexes were included but no results have been reported by sex. Analysis of covariance found that the associations obersevered were independent of sex.,Diabetes Fonds Nederland and the European Economic Committee,Clinical,No
1999,May,N/A,Role of the human kidney in glucose counterregulation.,Meyer et al.,3,Both,Used 9 men and 10 women. Data presented is not sex segregated.,Division of Research Resources–GCRC Grant and the National Institute of Diabetes and Digestive and Kidney Diseases.,Clinical,Yes
1999,May,N/A,Insulin action on muscle protein kinetics and amino acid transport during recovery after resistance exercise.,Biolo et al.,1,Male,5 males were used. No explanation as to why female subjects were not used.,National Institutes of Health (DK-38010) and Shriners Hospitals for Children (8490).,Clinical,Yes
1999,May,N/A,Splanchnic and leg substrate exchange after ingestion of a natural mixed meal in humans.,Capaldo et al.,1,Male,11 male human subjects used. No reason provided as to why females were not included.,n/a,Clinical,N/a
1999,May,N/A,Endogenous glucose production and glucose effectiveness in type 2 diabetic subjects derived from stable-labeled minimal model approach.,Nagaska et al.,3,Both,Studied total of 11 nonobese (BMI <25) type 2 diabetic patients 4 males and 7 females. Control subjects 3 males and 5 females. The data presented is not sex segregated.,"Ministry of Education, Science and Culture of Japan, and Jichi Medical School Young Investigator Award.",Clinical,No
1999,May,N/A,Plasma and interstitial glucose dynamics after intravenous glucose injection: evaluation of the single-compartment glucose distribution assumption in the minimal models.,Regittnig et al.,3,Both,"Six subjects with type 1 diabetes, 3 men and 3 women. No sex segregated figures provided.",Jubiläumsfond der Österreichischen National Bank and the Government of Styria.,Clinical,No
1999,May,N/A,Hepatic insulin resistance and defects in substrate utilization in cystic fibrosis.,Hardin et al.,3,Both,Studied 29 Cystic Fibrosis CF and 18 control subjects of both sexes. No sex segregated data provided.,NIH and a grant from the National Cystic Fibrosis Foundation.,Clinical,No
1999,May,N/A,Tumor necrosis factor system activity is associated with insulin resistance and dyslipidemia in myotonic dystrophy.,Fernández-Real et al.,4,Both,Studied control and Myotonic dystrophy (MyD) males and females. Table 1 provides sex segregated data. There was some analysis done by sex and numerical data provided. Figures were not sex segregated.,Comision Asesora de Investigacion Cientifica y Tecnica SAF,Clinical,No
1999,May,N/A,Activation of the tissue factor pathway of blood coagulation during prolonged hyperglycemia in young healthy men.,Rao et al.,1,Male,"14 healthy human males volunteers. Nine men placed in hyperglycemia group, and five men in hyperinsulinemia group. NO reason given as to why female volunteers were not included.","National Institutes of Health Grants R01-AG-07988 (G.B.), R01-AA-10221 (G.B.), K07- HL02658 (A.K.R.), and RR-00349 (General Clinical Research Center branch of the National Center for Research R e s o u r c e s ) .",Clinical,Yes
1999,May,N/A,Acute exercise induces GLUT4 translocation in skeletal muscle of normal human subjects and subjects with type 2 diabetes.,Kennedy et al.,3,Both,Used male and female human subjects of Type 2 diabetes background and control healthy subjects. No sex segregated data presented.,National Institutes of Health and Boehringer Mannheim Corporation.,Clinical,Yes
1999,June,N/A,Effects of aggressive cholesterol lowering and low-dose anticoagulation on clinical and angiographic outcomes in patients with diabetes: the Post Coronary Artery Bypass Graft Trial.,Hoogwerf et al.,3,Both,A score of 3 was given as both sexes of humans were included to observe the effects after CABG trial of aggressive cholesterol lowering and low-dose anticoagulation in control and diabetic patients. Data was not sex segregated.,"National Heart, Lung, and Blood Institute, National Institutes of Health and Merck.",Clinical,Yes
1999,June,N/A,"Endothelium-dependent vasodilatation, plasma markers of endothelial function, and adrenergic vasoconstrictor responses in type 1 diabetes under near-normoglycemic conditions.",Huvers et al.,3,Both,A score of 3 was given as both male and female humans control and a group with Type 1 diabetes was followed. No sex segregated data presented.,Diabetes Fonds Nederland,Clinical,No
1999,June,N/A,Protein kinase C activity is acutely regulated by plasma glucose concentration in human monocytes in vivo.,Ceolotto et al.,0,n/a,A score of 0 was given as sex was unspecified. No sex segregated data provided.,Regione Veneto,Clinical,No
1999,July,N/A,"Hypoglycemia per se stimulates sympathetic neural as well as adrenomedullary activity, but, unlike the adrenomedullary response, the forearm sympathetic neural response is not reduced after recent hypoglycemia.",Paramore et al.,3,Both,A score of 3 was given as this study used 7 human males and 3 females. The data was not presented in a sex segregated manner.,U.S. Public Health Service,Clinical,No
1999,August,N/A,Regional postprandial fatty acid metabolism in different obesity phenotypes.,Guo et al.,1,Female,A score of 1 was given as the study only used women. In the discussion similar studies done with males were discussed however no justification present for excluding male subjects.,"Minnesota Obesity Center, U.S. Public Health Service and by the Mayo Foundation.",Clinical,No
1999,August,N/A,Plasma phospholipid transfer protein activity is lowered by 24-h insulin and acipimox administration: blunted response to insulin in type 2 diabetic patients.,Riemens et al.,1,Male,A score of 1 was given as only male case an control human subjects were followed.,Dutch Diabetes Foundation,Clinical,No
