Year,Month,Area,Article,Author,Score,Sex,Notes,Funding,Clinical vs Biomedical,NIH
2009,November,Obesity Studies,Brown Adipose Tissue and Seasonal Variation in Humans,Au-Yong et al,3,,"A score of 3 was given although results were analyzed by sex (χ2 test was used, would warrant score of 6 if data were sex-segregated) because no sex-segregated data was provided.",Nottingham Digestive Diseases Biomedical Research Unit and the Respiratory Biomedical Research Unit.,Biomedical,No
2009,December,Obesity Studies,Differences in the Central Anorectic Effects of Glucagon-Like Peptide-1 and Exendin-4 in Rats,Barrera et al,1,Male,A score of 1 was given because only male rats were used (male Long-Evans rats).,"National Institutes of Health Grant RO1 DK54890 (to R.J.S.), American Diabetes Association Physician Scientist Training Award 7-06-PST-02 (to J.G.B.), National Institutes of Health Grant RO1 DK57900 (to D.A.D.), Juvenile Diabetes Research Foundation Grant 1-2006-796 (to D.J.D.), and research funding from Amylin Pharmaceuticals.",Biomedical,Yes
2009,December,Obesity Studies,SIRT1 Genetic Variation Is Related to BMI and Risk of Obesity,Zillikens et al,3,,"A score of 3 was given because both sexes of human subjects were included, and because no sex-segregated data was provided. Data was sex-adjusted (unclear method of adjustment)","Netherlands Organization for Scientific Research under the Research Institute for Diseases in the Elderly (grant 014-90-001) and the European Commission (QL46-CT-2002-02629, GENOMOS, Health-F2-2008-201865, GEFOS) and is supported by the Netherlands Genomics Initiative/Netherlands Organization for Scientific Research (project no. 050-060-810). The ERF study was supported by a joint grant from the Center of Medical Systems Biology.",Biomedical,No
2009,January,Obesity Studies/ Original Article?,Skeletal Muscle–Specific Deletion of Lipoprotein Lipase Enhances Insulin Signaling in Skeletal Muscle but Causes Insulin Resistance in Liver and Other Tissues,Wang et al,1,Male,Only male mice were used. Female exclusion was not justified,"NIH, American Diabetes Association, the Pennsylvania State Department of Health ",Biomedical,Yes
2009,February,Pathophysiology,Intergenerational Transmission of Glucose Intolerance and Obesity by In Utero Undernutrition in Mice, Jimenez-Chillaron et al.,2,Male,"Score of 2 awarded, as only male F2 mice were included in analysis. Justification was provided: there was a higher prevalence of diabetes in UN-F1 males (100% vs. 30% in females). Overall, the study investigated how in utero nutrition (of F1) can effect glucose tolerance and obesity in F2 mice. They did investigate sex differences in terms of which F1 parent the F2 phenotypes seemed to be inherited from (i.e. male or female parent), but the only F2 mince included for analysis were male.","American Diabetes Association, Graetz Family Fund, the Marie Curie International Reintegration Grant, Diabetes Endocrinology Research Center",Biomedical,No
2009,March,Pathophysiology,Angiotensin II Reduces Mitochondrial Content in Skeletal Muscle and Affects Glycemic Control,Mitsuishi et al.,1,Male,"Score of 1 awarded, as most experiments took place in C57bl/6 mice that were exclusively male. No explaination for the exclusion of female mice was provided. Additional experiments were performed in C2C12 cells; the sex of these cells was not specified.",N/A,Biomedical,N/A
2009,March,Pathophysiology,Amylase α-2A Autoantibodies; Novel Marker of Autoimmune Pancreatitis and Fulminant Type 1 Diabetes,Endo et al.,3,N/A,"Score of 3 awarded, as most experiments included both men and women. AIP serum used to do screening of the human pancreas cDNA library came from a single male individual. All of the diabetic groups were composed of both men and women (although these proportions were not equal: for example, autoimmune pancreatitis patients were 14/15 male and 1/15 female, while Hashimoto's thyroiditis patients were 6/47 male and 41/47 female). Control sera samples were taken from healthy, male and female volunteers. No results were reported/ analyzed by sex.",N/A,Biomedical,N/A
2009,May,Pathophysiology,Accelerated Postnatal Growth Increases Lipogenic Gene Expression and Adipocyte Size in Low–Birth Weight Mice,Isganaitis et al.,3,Both,Pregnant females ICR and ICR offspring sex unspecified for specific portions. Data for white adipose tissue gene expression at age 3 weeks from males and hypothalamic agouti-related peptide (AgRP) neuronal projections from 6 month old males. From the supplementary most of data is based on males. No sex segregated data.,"American Diabetes Association (both to M.-E.P.); the Endocrine Fellows Foundation, the Human Growth Foundation, and the Lawson-Wilkins Pediatric Endocrine Society (to E.I.); DK57768 (to M.G.M.); and an American Heart Association Predoctoral Fellowship (to R.L.L.).",Biomedical,No
2009,May,Pathophysiology,Mechanisms of Podocyte Injury in Diabetes,Eid et al.,0,N/a,"Immortalized mouse podocytes of -7-month-old FVB and OVE26 mice 6 mos used, sex unspecified.","National Kidney Foundation Postdoctoral Fellowship (to A.A.E.), an American Heart Association South Central Affiliate and Juvenile Diabetes Research Foundation regular research grant (to Y.G.), National Institutes of Health Grant K01DK-076923 (to K.B.), National Institutes of Health, George O'Brien Kidney Center-morphology core grant no. DK061597 (to J.L.B.), and National Institutes of Health Grant DK-R01-078971 and grants from the American Diabetes Association and the Juvenile Diabetes Research Foundation (to H.E.A.).",Biomedical,Yes
2009,June,Pathophysiology,Increased Risk of Type 2 Diabetes in Elderly Twins,Poulsen et al.,4,Both,#NAME?,N/a,Biomedical,N/a
2009,August,Pathophysiology,Endoplasmic Reticulum Stress Regulates Adipocyte Resistin Expression,Lefterova et al.,1,Male,Used wild-type male C57Bl/6 mice.,National Institutes of Health,Biomedical,Yes
2009,August,Pathophysiology,Apolipoprotein B but not LDL Cholesterol Is Associated With Coronary Artery Calcification in Type 2 Diabetic Whites,Martin et al.,3,Both,Male and female human subjects were studied. Model 1 was adjusted for sex. No sex segregated data presented or discussion of sex similarities or differences.,National Center for Research Resources (NCRR).,Biomedical,Yes
2009,November,Pathophysiology,FoxO1 Links Insulin Resistance to Proinflammatory Cytokine IL-1β Production in Macrophages,Su et al,1,Male,"A score of 1 was given because peritoneal macrophages from only male mice were used (Male homozygous db/db mice, male Balb/c mice)",American Diabetes Association and National Health Institute Grant DK-066301.,Biomedical,No
2009,November,Pathophysiology,Placental Structure in Type 1 Diabetes,Nelson et al,2,Female,A score of 2 was given because only female human subjects were included and was justified (placentae were required).,Chief Scientist Office of the Scottish Executive (K/MRS/50/C2726) and the Glasgow Royal Infirmary Research Endowment Fund (05REF007).,Biomedical,No
2009,December,Pathophysiology,Endoplasmic Reticulum Stress in Diabetic Hearts Abolishes Erythropoietin-Induced Myocardial Protection by Impairment of Phospho–Glycogen Synthase Kinase-3β–Mediated Suppression of Mitochondrial Permeability Transition,Miki et al,1,Male,A score of 1 was given because only male rats were used (Male Otsuka Long-Evans-Tokushima fatty rats (OLETF)).,"Japan Society for Promotion of Science, Tokyo, Japan, and a grant from Chugai Pharmaceutical, Tokyo, Japan. Human recombinant erythropoietin was provided by Chugai Pharmaceutical. OLETF and LETO rats were gifts from the Tokushima Research Institute of Otsuka Pharmaceutical, Tokushima, Japan.",Biomedical,No
2009,December,Pathophysiology,Prenatal Programming of Metabolic Syndrome in the Common Marmoset Is Associated With Increased Expression of 11β-Hydroxysteroid Dehydrogenase Type 1,Nyirenda et al,1,Male,"A score of 1 was given because only male monkeys were used (One male offspring from each litter of adult common marmoset monkeys), and since the female monkeys that were involved in dexamethasone treatment were female because they were mothers.","European Commission Grant QLRT-2001-02758 (EUPEAH). M.J.N. is a recipient of an MRC clinician fellowship. A.d.V. is currently affiliated with the TMRC (Translational Medicine Research Collaboration) Laboratory, University of Dundee, U.K.",Biomedical,No
2009,December,Pathophysiology,Natriuretic Peptides/cGMP/cGMP-Dependent Protein Kinase Cascades Promote Muscle Mitochondrial Biogenesis and Prevent Obesity,Myishita et al,0,,"A score of 0 was given because sex was unspecified for the mice (brain NP (BNP) transgenic (BNP-Tg), cGK-Tg, and guanylyl cyclase-A (GCA) heterozygous knockout (GCA+/−) mice).","Japanese Ministry of Education, Culture, Sports, Science, and Technology; the Ministry of Health, Labor, and Welfare; the University of Kyoto 21st Century Centers of Excellence Program; and grants from the Takeda Medical Research Foundation and the Smoking Research Foundation.",Biomedical,No
2009,April,Pharmacology and Therapeutics,Pharmacological Stimulation of NADH Oxidation Ameliorates Obesity and Related Phenotypes in Mice,Hwang et al.,1,Male,"Score of 1 awarded, as only male mice (ob/ob and C57BL/6) were used. No justifiaction for the exclusion of females was given. ","Korea Science and Engineering Foundation, the Ministry of Education, Science and Technology, MarineBio Research Grant, Ministry of Maritime and Fisheries and KT&G grant; Korea, National Research Laboratory program, KOSEF, Ministry of Education, Science and Technology, Korea",Biomedical,No
2009,April,Pharmacology and Therapeutics,GLP-1R Agonist Liraglutide Activates Cytoprotective Pathways and Improves Outcomes After Experimental Myocardial Infarction in Mice,Noyan-Ashraf et al.,1,Male,"Score of 1 awarded, as only male C57BL/6 mice were used. No justification for the exclusion of female mice was provided. ","Heart and Stroke Foundation of Ontario, CIHR, Novo Nordisk",Biomedical,No
2009,January,Pharmacology and theraputics,Insulin Reduces Cerebral Ischemia/Reperfusion Injury in the Hippocampus of Diabetic Rats,Collino et al,1,Male,"Used Wistar rats, no explaintion for female exclusion","Wiliam Harvey Research Foundation, Turin University funding, Alfieri Project",Biomedical,No
2009,January,Pharmacology and theraputics,Inhibition of Dipeptidyl Peptidase-4 by Vildagliptin During Glucagon-Like Peptide 1 Infusion Increases Liver Glucose Uptake in the Conscious Dog,Edgerton et al,0,,"Used dogs, but made no mention to age, sex breed etc. Only referred to them as 'healthy and conscious'",Novartis Institute for Biomedical Research,Biomedical,No
2009,January,Pharmacology and theraputics,"Fibroblast Growth Factor 21 Reverses Hepatic Steatosis, Increases Energy Expenditure, and Improves Insulin Sensitivity in Diet-Induced Obese Mice",Xu et al,1,Male,"Male C57BL/6 mice, no reason for female exclusion",N/A,Biomedical,N/A
2009,January,Signal Transduction,Hypoxia Decreases Insulin Signaling Pathways in Adipocytes,Regazzetti et al,0,,"Used human embryonic kidney cells (HEK-293) and preadipocytes, as well as murine cell cultures. The sex of the cells used was not discussed at any time.","Institut National de la Santé et de la Recherche Médicale (INSERM, France), the Association for Research on Diabetes (Paris, France), the University of Nice-Sophia Antipolis, Region Provence-Alpes-Cote-d'Azur, and Conseil Général des Alpes Maritimes, European Commission, Association de Langue Française pour l'Etude du Diabète et des Maladies Métaboliques (ALFEDIAM)-Merck Lipha Santé and ALFEDIAM-Roche Diagnostics",Biomedical,No
2009,February,Signal Transduction,DOC2B: A Novel Syntaxin-4 Binding Protein Mediating Insulin-Regulated GLUT4 Vesicle Fusion in Adipocytes,Fukuda et al.,0,N/A,Score of 0 given because the paper did not mention the sex of the 3T3-L1 fibroblasts that they used.,"Ministry of Education, Culture, Sports, Science, and Technology of Japan, Takeda Scientific Foundation, Research Grant for Longevity Science",Biomedical,No
2009,March,Signal Transduction,"Dact1, a Nutritionally Regulated Preadipocyte Gene, Controls Adipogenesis by Coordinating the Wnt/β-Catenin Signaling Network",Lagathu et al.,1,Male,"Score of 1 awarded as the mice used were specified to male, and the majority of experiments were performed on mice. The exclusion of females was not mentioned or justified. Human tissues were of unspecified sex, as were the 3T3-L1 cells. Sex-matched controls were mentioned for the ob/ob mouse high fat diet experiment; this seems to imply the use of male experimental mice and male control mice, rather than the use of both sexes, as females are not mentioned. ","Biotechnology and Biological Science Research Council (BBSRC), MRC, Diabetes UK, and the European Union Sixth Framework Programme on Hepatic and Adipose Tissue Functions in the Metabolic Syndrome ",Biomedical,No
2009,May,Signal Transduction,High Glucose Suppresses Epidermal Growth Factor Receptor/Phosphatidylinositol 3-Kinase/Akt Signaling Pathway and Attenuates Corneal Epithelial Wound Healing,Xu et al.,0,N/a,Unspecified sex. Human cornea culture and porcupine cornea culture was used to investigate the effects of high glucose on epidermal growth factor receptor (EGFR),"National Institutes of Health, Midwest Eye Banks and Research to Prevent Blindness.",Biomedical,Yes
2009,May,Signal Transduction,Interleukin-6 Attenuates Insulin-Mediated Increases in Endothelial Cell Signaling but Augments Skeletal Muscle Insulin Action via Differential Effects on Tumor Necrosis Factor-α Expression,Yuen et al.,1,Male,Human aortic endothelial cells (HAECs) and male hooded Wistar rats were used for all experiments without a justification as to why females were not used as well.,National Health and Medical Research Council of Australia.,Biomedical,No
2009,May,Signal Transduction,Inhibition of Contraction-Stimulated AMP-Activated Protein Kinase Inhibits Contraction-Stimulated Increases in PAS-TBC1D1 and Glucose Transport Without Altering PAS-AS160 in Rat Skeletal Muscle,Funai and Cartee,1,Male,"Male Wistar rats, human recombinant insulin,",National Institutes of Health Grants.,Biomedical,Yes
2009,May,Signal Transduction,Degradation of cAMP-Responsive Element–Binding Protein by the Ubiquitin-Proteasome Pathway Contributes to Glucotoxicity in β-Cells and Human Pancreatic Islets,Costes et al.,1,Male,"Islets from male Wistar and Goto-Kakizaki (GK) rats, human cell culture sex unknown harvested from human pancreata from 3 brain-dead nonobese nondiabetic donors..",Association pour la Recherche sur le Diabète-INSERMand a Fondation pour la Recherche Médical.,Biomedical,No
2009,June,Signal Transduction,"PTPN2, a Candidate Gene for Type 1 Diabetes, Modulates Interferon-γ–Induced Pancreatic β-Cell Apoptosis",Moore et al.,1,Male,#NAME?,"Fonds National de la Recherche Scientifique (FNRS-FRSM) Belgium, the Communauté Française de Belgique–Actions de Recherche Concertées (ARC), the European Union (STREP Savebeta, contract number 036903; in the Framework Programme 6 of the European Community), and the Belgium Program on Interuniversity Poles of Attraction initiated by the Belgium State (IUAP P6/40). F.M. is the recipient of a post-doctoral fellowship from FNRS, Belgium. M.L.C. is the recipient of a scholarship from CAPES (Brazilian Coordination for the Improvement of Higher Education Personnel).",Biomedical,No
2009,July,Signal Transduction,Hypothalamic Reactive Oxygen Species Are Required for Insulin-Induced Food Intake Inhibition,Jaillard et al.,1,Male,Used male C57BL6/J mice to investigate the involvement of hypothalamic ROS and NADPH oxidase in the insulin regulated feeding behavior regulation. No reason given as to why female C57BL6/J mice were not utilized as well. No discussion of sex.,Agence Nationale de la Recherche Grant and the Institut Benjamin Delessert.,Biomedical,No
2009,Sept,Signal Transduction,Resistin-Like Molecule-β Inhibits SGLT-1 Activity and Enhances GLUT2-Dependent Jejunal Glucose Transport,Krimi et al,1,Male,"A score of 1 was given because only male mice were used for all experiments (Male C57BL/6J mice, OPG−/−, Adipoq−/−, ob/ob, and db/db mice).",Institut National de la Recherche Médicale (INSERM),Biomedical,No
2009,Sept,Signal Transduction,SH2B1 Enhances Insulin Sensitivity by Both Stimulating the Insulin Receptor and Inhibiting Tyrosine Dephosphorylation of Insulin Receptor Substrate Proteins,Morris et al,1,Male,"A score of 1 was given because only male mice were used (Wild-type (WT) and TgKO males on HFD, Primary liver cells isolated from male mice)","National Institutes of Health, American Diabetes Association Award",Biomedical,Yes
2009,October,Signal Transduction,Increased MAPK Activation and Impaired Insulin Signaling in Subcutaneous Microvascular Endothelial Cells in Type 2 Diabetes: The Role of Endothelin-1,Gogg et al,3,,A score of 3 was given because microvascular endothelial cells (MVEC) from both sexes of human subjects were included (supplementary info).,"Swedish Medical Research Council (K2005-72X-15389-01A), (K2008-55X-15358-04-3), and (K2007-54X-03506-36-3), the Novo Nordisk Foundation, the Swedish Diabetes Association, the Torsten and Ragnar Söderbergs Foundations, the Inga-Britt and Arne Lundberg Foundation, the Foundation for Strategic Research and the European Community as part of the project EUGENE2, which is supported by the European Commission",Biomedical,No
2009,October,Signal Transduction,Activation of the AMPK-FOXO3 Pathway Reduces Fatty Acid–Induced Increase in Intracellular Reactive Oxygen Species by Upregulating Thioredoxin,Li et al,1,Male,"A score of 1 was given only male mice were included (ApoE−/− male mice, one out of eight figures of data), although sex was unspecified for cell culture (human endothelial aortic cells) (would warrant score of 0 by itself).","American Heart Association Grants AHA-TX 0565134Y (to Y.H.S.) and AHA-0730190N (to Y.H.S.), National Institutes of Health Grant R01-HL071608 (to X.L.W.), and Natural Science Foundation of China Grants",Biomedical,Yes
2009,December,Signal Transduction,Functional Role of Neuroendocrine-Specific Protein-Like 1 in Membrane Translocation of GLUT4,Ikemoto et al,1,Male,A score of 1 was given because only male mice were used.,"molecular imaging program of Research Base for Exploring New Drugs, from the Ministry of Education, Culture, Sports, Science, and Technology (MEXT), Japan.",Biomedical,No
2009,December,Signal Transduction,Glucose Deprivation Regulates KATP Channel Trafficking via AMP-Activated Protein Kinase in Pancreatic β-Cells,Lim et al,0,,A score of 0 was given because the cell cultures and the β-cells from Sprague-Dawley rats were of unspecified sex.,"National Research Laboratory Program (R0A-2004-000-10295-0) funded by the Korean Ministry of Education, Science and Technology. A.L. and S.-H.P. were supported by the BK21 Program from the Korean Ministry of Education and Human Resources Development.",Biomedical,No
2019,January,Complications,VEGFC Reduces Glomerular Albumin Permeability and Protects Against Alterations in VEGF Receptor Expression in Diabetic Nephropathy,Onions et al,1,Male,Score of 1 awarded as only male mice (C57BLKsJ-db/db) were involved. No justification for female exclusion provided. Human cells (ciGEnCs) used for human in vitro experiments were of unspecified sex. ,"British Heart foundation (BHF), Kidney Research UK, European Foundation for the Study of Diabetes, Medical Research Councill Clinician Scientist award, Diabetes Research Wellness Foundation",Biomedical,No
2019,February,Complications,Targeting the CDA1/CDA1BP1 Axis Retards Renal Fibrosis in Experimental Diabetic Nephropathy,Chai et al.,1,Male,"Score of 1 awarded as only male mice (ApoE KO, wild-type (WT), and CDA1BP1 KO mice, all on C57BL/6 background) were used. No justification for female exclusion was provided.",National Health and Medical Research Council (NHMRC) of Australia,Biomedical,NO
2019,February,Complications,NLRP3 Promotes Diabetic Bladder Dysfunction and Changes in Symptom-Specific Bladder Innervation,Hughes et al.,1,Female,Score of 1 awarded as only female mice were used. No justifcation for the exclusion of male animals Is provided.,"NIH (NIDDK), Urology Care Foundation, Russell Scott Jr. MD Urology Research Fund ",Biomedical,Yes
2019,February,Complications,Multiethnic Genome-Wide Association Study of Diabetic Retinopathy Using Liability Threshold Modeling of Duration of Diabetes and Glycemic Control,Pollack et al.,0,,Score of 0 awarded as the sex of the participants is not referenced at all in this article.,"Research to Prevent Blindness, NIH, Massachusetts Lions Eye Research Fund, Alcon Research Institute, American Diabetes Association, Harvard Catalyst, Hjartavernd (the Icelandic Heart Association), the Althingi (Icelandic Parliament), the University of Iceland Research Fund, Australian National Health and Medical Research Council (NHMRC), Ophthalmic Research Institute of Australia, Centre for Clinical Research Excellence in Translational Clinical Research in Eye Diseases, the Wellcome Trust, Tenovus Scotland, Chief Scientist Office Scotland, Diabetes UK,  the Innovative Medicines Initiative for SUMMIT, Folkhälsan Research Foundation, the Wilhelm and Else Stockmann Foundation, the Liv och Hälsa Foundation, Helsinki University Central Hospital Research Funds (EVO), the Novo Nordisk Foundation, the Academy of Finland, National Medical Research Council (NMRC) Singapore, Biomedical Research Council Singapore, National Research Foundation of Korea, Centre for Inherited Disease Research, Genetics of Latinos Diabetic Retinopathy (GOLDR), Eye Birth Defects Foundation Inc., the National Science Council Taiwan",Biomedical,No
2019,March,Complications,The Role of Prostaglandins in Disrupted Gastric Motor Activity Associated With Type 2 Diabetes,Blair et al.,0,N/A,"Score of 0 awarded, as the sex of the mice used in the experiments was unspecified.","NIH, Diabetic Complications Consortium (DiaComp) Pilot Funding, National Center for Research Resources",Biomedical,Yes
2019,April,Complications,Opposing Effects of Neuropilin-1 and -2 on Sensory Nerve Regeneration in Wounded Corneas: Role of Sema3C in Ameliorating Diabetic Neurotrophic Keratopathy,Lee et al.,3,N/A,"Score of 3 awarded, as both male and female mice were used. Results were not analyzed or reported by sex.","NIH, Research to Prevent Blindness",Biomedical,Yes
2019,April,Complications,Proximal Tubular Cell–Specific Ablation of Carnitine Acetyltransferase Causes Tubular Disease and Secondary Glomerulosclerosis,Kruger et al.,1,Male,"Score of 1 awarded, as experiments were performed on male mice only. No justification for the exclusion of female mice was provided. ","Singapore National Medical Research Council, NIH",Biomedical,Yes
2019,May,Complications,Monosodium Urate Contributes to Retinal Inflammation and Progression of Diabetic Retinopathy,Thounaojam et al.,1,Male,Male Sprague-Dawley rats. No reason given as to why females were not used as well. Sex not discussed further in results and discussion.,International Retinal Research Foundation and from the National Institutes of Health National Eye Institute.,Biomedical,Yes
2019,May,Complications,Diabetes-Induced DUSP4 Reduction Promotes Podocyte Dysfunction and Progression of Diabetic Nephropathy,Denhez et al.,1,Male,Male mice were used. No justification present.,"Canadian Institutes of Health Research, Institute of Nutrition, Metabolism and Diabetes.",Biomedical,No
2019,June,Complications,Ameliorating Methylglyoxal-Induced Progenitor Cell Dysfunction for Tissue Repair in Diabetes,Li et al.,3,"Both for human, male T2DM mice.","Used 3:1 ratio of males and females in vitro culture, used male mice.",National Institute of Diabetes and Digestive and Kidney Diseases,Biomedical,Yes
2019,June,Complications,Diabetes-Associated Myelopoiesis Drives Stem Cell Mobilopathy Through an OSM-p66Shc Signaling Pathway,Albeiro et al.,3,Both,Sex matched mice. In the supplementary data only male human subjects present. No justification for the lack of female data.,"European Foundation for the Study of Diabetes Novartis, Ministry of University and Education Progetti di Rilevante Interesse Nazional.",Biomedical,No
2019,July,Complications,"LRNA9884, a Novel Smad3-Dependent Long Noncoding RNA, Promotes Diabetic Kidney Injury in db/db Mice via Enhancing MCP-1–Dependent Renal Inflammation",Zhang et al.,1,Male,Used db/db male mice with no justification present to clarify why one sex was used..,"Research Grants Council of Hong Kong, Health and Medical Research Fund, Lui Che Woo Institute of Innovative Medicine (CARE), and the Major State Basic Research Development Program of China",Biomedical,No
2019,August,Complications,Hyperglycemia Enhances Constriction of Retinal Venules via Activation of the Reverse-Mode Sodium-Calcium Exchanger,Chen et al.,1,Male,Yorkshire male pigs were used to study the impact of hyperglycemia on retinal venules. No reason given as to why female pigs were not used.,"Taylor Scott & White-Central Texas Foundation, the Ophthalmic Vascular Research Program of Baylor Scott & White Health, the Kruse Chair Endowment, the Retina Research Foundation, and National Institutes of Health National Eye Institute.",Biomedical,Yes
2019,August,Complications,Angiogenic Factor AGGF1-Primed Endothelial Progenitor Cells Repair Vascular Defect in Diabetic Mice,Yao et al.,1,Male,Male C57BL/6J mice and db/db mice were used.,"National Natural Science Foundation of China (grants 81630002 and 31430047), Hubei Province’s Innovative Team (grant 2017CFA014), and China Postdoctoral Science Foundation–funded project",Biomedical,No
